{
  "schema_version": "1.0",
  "snapshot_id": "CTX-STATE-000",
  "parent_snapshot_id": null,
  "revision": 0,
  "status": "accepted",
  "owner": "Project owner (identity unresolved)",
  "created_at": "2026-07-29T00:00:00Z",
  "created_by_event": null,
  "policy_version": "loop-policy-v1",
  "rollback_snapshot_id": null,
  "entries": []
}
